{
  "$schema": "https://json-schema.org/draft/2020-12/schema",
  "$id": "https://keel.invalid/schemas/result.schema.json",
  "title": "keel seat result",
  "description": "A seat's result (result.json), returned on its submit channel and passed to the runtime's schema flag inline or by path per descriptor. The submit gate checks the schema and the BR echo, then recompiles the brief.",
  "$comment": "Authored in the OpenAI strict subset (every property required, additionalProperties false, null unions instead of optional fields); scripts/validate.mjs lints it. Before passing it to a runtime flag the dispatcher bundles the $refs and strips $schema, $id, $comment, title and x-keel-* annotations.",
  "x-keel-strict-subset": true,
  "x-keel-status": "stable",
  "x-keel-milestone": "M2",
  "type": "object",
  "properties": {
    "kind": {
      "enum": ["result"]
    },
    "brief_hash": { "description": "BR echo.", "$ref": "common.schema.json#/$defs/briefId" },
    "subject": {
      "anyOf": [
        { "$ref": "common.schema.json#/$defs/proposalId" },
        { "$ref": "common.schema.json#/$defs/taskId" }
      ]
    },
    "seat": { "$ref": "common.schema.json#/$defs/seat" },
    "status": { "$ref": "common.schema.json#/$defs/resultStatus" },
    "goal_echo": { "description": "The goal this work serves, restated.", "type": "string" },
    "summary": { "type": "string" },
    "rulings": {
      "description": "Rulings made inside the decision boundaries.",
      "type": "array",
      "items": { "$ref": "#/$defs/ruling" }
    },
    "questions": {
      "description": "Open questions; needed when status is NEEDS_CONTEXT.",
      "type": "array",
      "items": { "$ref": "ack.schema.json#/$defs/question" }
    },
    "blocker": {
      "description": "Why the seat is blocked when status is BLOCKED, else null.",
      "type": ["string", "null"]
    },
    "handoff": { "$ref": "#/$defs/handoff" },
    "files": {
      "description": "The proposal files a product, architect or planner seat authored (intent.md, spec.delta.yaml, answer.md, arch.delta.yaml, decisions/ADR-*.md, plan.yaml, workorders/T<n>.yaml), with their full contents. These seats run in read-only modes, so the Steward checks each path against the seat's writable globs, writes the bytes into the planning worktree and commits them. Empty for the engineer, whose changes are in its task worktree.",
      "type": "array",
      "items": { "$ref": "#/$defs/authoredFile" }
    }
  },
  "required": [
    "kind",
    "brief_hash",
    "subject",
    "seat",
    "status",
    "goal_echo",
    "summary",
    "rulings",
    "questions",
    "blocker",
    "handoff",
    "files"
  ],
  "additionalProperties": false,
  "$defs": {
    "authoredFile": {
      "description": "One authored proposal file.",
      "type": "object",
      "properties": {
        "path": {
          "description": "Repository path, for example .keel/proposals/P-7F3K9Q-note-tags/intent.md.",
          "$ref": "common.schema.json#/$defs/repoPath"
        },
        "content": { "description": "The full UTF-8 file content.", "type": "string" }
      },
      "required": ["path", "content"],
      "additionalProperties": false
    },
    "ruling": {
      "description": "A ruling (keel api rule). One outside the decision boundaries, or on a stop class, is flagged to the Board.",
      "type": "object",
      "properties": {
        "clause": { "description": "Id of the clause the ruling interprets.", "type": "string" },
        "what": { "type": "string" },
        "why": { "type": "string" },
        "cost_if_wrong": { "$ref": "#/$defs/cost" },
        "reversible": { "type": "boolean" }
      },
      "required": ["clause", "what", "why", "cost_if_wrong", "reversible"],
      "additionalProperties": false
    },
    "cost": {
      "description": "Cost if the ruling is wrong; receipts list rulings by cost.",
      "enum": ["low", "medium", "high"]
    },
    "handoff": {
      "description": "Handoff notes for the next seat and the receipt.",
      "type": "object",
      "properties": {
        "notes": { "type": "string" },
        "not_tested": {
          "description": "What was not tested; each entry becomes a Not-tested trailer.",
          "type": "array",
          "items": { "type": "string" }
        },
        "concerns": {
          "type": "array",
          "items": { "type": "string" }
        },
        "next": {
          "description": "Suggested next step, or null.",
          "type": ["string", "null"]
        }
      },
      "required": ["notes", "not_tested", "concerns", "next"],
      "additionalProperties": false
    }
  }
}
